{
  "testType": "documentation-structure",
  "command": "python tools/validate-standards/validate_repository.py && python tools/check-links/check_links.py",
  "result": "passed",
  "environment": "GitHub Actions Ubuntu runner",
  "evidence": "Repository validation workflow",
  "limitations": [
    "No application source, runtime, deployment, performance, accessibility, or recovery test was executed."
  ]
}
